{
  "task_id": "CREW-TASK-EXAMPLE-001",
  "title": "Create Crew Core foundation",
  "purpose": "Preview an internal AI_OS builder crew task before APPLY.",
  "owner": "Human Owner",
  "status": "PROPOSED",
  "priority": "normal",
  "allowed_paths": [
    "docs/AI_OS/orchestration/crew/",
    "automation/orchestration/crew/"
  ],
  "blocked_paths": [
    "broker/",
    "OANDA/",
    "api_keys/",
    "live_trading/",
    "services/",
    "telemetry/"
  ],
  "stop_point": "DRY_RUN_REPORT_ONLY"
}
